{
  "$schema": "https://json-schema.org/draft/2020-12/schema",
  "$id": "https://rezonating.com/schemas/sidecar/v0",
  "title": "Rezonating recording sidecar",
  "description": "JSON file next to every WAV recording (same base name). Describes setup and labels. DRAFT v0 - Tier 1.",
  "type": "object",
  "additionalProperties": false,
  "required": ["schema", "session", "node", "firmware", "start_utc", "sample_rate", "channels", "protocol"],
  "properties": {
    "schema": { "const": 0 },
    "session": {
      "type": "string",
      "pattern": "^\\d{4}-\\d{2}-\\d{2}_[a-z0-9-]+_[a-z0-9-]+_\\d{2}$",
      "description": "YYYY-MM-DD_<site>_<room>_<nn>"
    },
    "node": { "type": "string" },
    "firmware": { "type": "string" },
    "start_utc": { "type": "string", "format": "date-time" },
    "sample_rate": { "type": "integer", "minimum": 1 },
    "kind": { "enum": ["continuous", "event"], "default": "continuous" },
    "channels": {
      "type": "array",
      "minItems": 1,
      "items": {
        "type": "object",
        "additionalProperties": false,
        "required": ["ch", "head", "serial", "units"],
        "properties": {
          "ch": { "type": "integer", "minimum": 0, "maximum": 7 },
          "port": { "type": "integer", "minimum": 1, "maximum": 4 },
          "head": { "type": "string", "examples": ["geophone/sm24"] },
          "serial": { "type": "string" },
          "units": { "enum": ["m/s", "g", "V", "counts"] },
          "scale": { "type": "number", "description": "Multiply raw counts by this to get units." },
          "gain": { "enum": [1, 2, 4, 8, 16, 32, 64, 128] },
          "mount": { "type": "string" },
          "surface": { "type": "string", "examples": ["laminate on concrete slab"] },
          "position_m": { "type": "array", "items": { "type": "number" }, "minItems": 2, "maxItems": 3 }
        }
      }
    },
    "protocol": { "type": "string", "examples": ["walk-pass-v1"] },
    "notes": { "type": "string" },
    "labels": {
      "type": "array",
      "items": {
        "type": "object",
        "required": ["t0", "t1", "label"],
        "properties": {
          "t0": { "type": "number", "minimum": 0 },
          "t1": { "type": "number", "minimum": 0 },
          "label": { "type": "string" },
          "person": { "type": "string", "pattern": "^P\\d+$", "description": "Pseudonym only, never a name." },
          "shoes": { "type": "boolean" },
          "pace": { "enum": ["slow", "normal", "fast"] }
        }
      }
    }
  }
}
